{
  "schemaVersion": "1.0",
  "runId": "run-1790516163895-4h4aij",
  "subjectDigest": "b3e65cea30e10e33435d78739e07af2d3b2f480639ef76a360910fea11b0cbc4",
  "generatedAt": "2026-09-27T13:39:57.767Z",
  "mode": "fixture",
  "collectionStatus": "complete",
  "overallRecommendation": "ALLOW",
  "keyReasons": [
    "No static observations were recorded in this evidence bundle.",
    "Fixture evidence is synthetic; downloaded-artifact integrity was not verified.",
    "Deterministic evidence collection completed successfully across all changed packages."
  ],
  "packages": [
    {
      "name": "picocolors",
      "version": "1.1.1",
      "previousVersion": "1.1.1",
      "location": "node_modules/picocolors",
      "changeType": "unchanged",
      "isDirect": true,
      "isDev": false,
      "isOptional": false,
      "resolved": "https://registry.npmjs.org/picocolors/-/picocolors-1.1.1.tgz",
      "integrity": "sha512-xceH2snhtb5M9liqDsmEw56le376mTZkEX/jEb/RxNFyegN536lNzk469YN14WOMVL62n30R6U8FL08HT8MFHg==",
      "previousIntegrity": "sha512-xceH2snhtb5M9liqDsmEw56le376mTZkEX/jEb/RxNFyegN536lNzk469YN14WOMVL62n30R6U8FL08HT8MFHg==",
      "hasInstallScript": false,
      "scripts": null,
      "unsupported": false,
      "unsupportedReason": null
    }
  ],
  "investigations": [
    {
      "schemaVersion": "1.0",
      "subjectDigest": "b3e65cea30e10e33435d78739e07af2d3b2f480639ef76a360910fea11b0cbc4",
      "role": "typosquat-detective",
      "status": "complete",
      "recommendation": "ALLOW",
      "findings": [],
      "unknowns": [
        "No added or changed packages in candidate diff; no typosquatting signals detected."
      ]
    },
    {
      "schemaVersion": "1.0",
      "subjectDigest": "b3e65cea30e10e33435d78739e07af2d3b2f480639ef76a360910fea11b0cbc4",
      "role": "provenance-auditor",
      "status": "complete",
      "recommendation": "ALLOW",
      "findings": [],
      "unknowns": [
        "No added or changed packages in candidate diff; baseline picocolors@1.1.1 is unmodified."
      ]
    },
    {
      "schemaVersion": "1.0",
      "subjectDigest": "b3e65cea30e10e33435d78739e07af2d3b2f480639ef76a360910fea11b0cbc4",
      "role": "behavior-analyst",
      "status": "complete",
      "recommendation": "ALLOW",
      "findings": [],
      "unknowns": [
        "Candidate contains zero lifecycle scripts, network operations, or child process executions."
      ]
    }
  ],
  "investigationComplete": true,
  "observations": [],
  "sources": [],
  "unknowns": [
    "Runtime dynamic effects were not executed or observed.",
    "Full cryptographic npm provenance was not verified (adapter extension pending).",
    "[typosquat-detective] No added or changed packages in candidate diff; no typosquatting signals detected.",
    "[provenance-auditor] No added or changed packages in candidate diff; baseline picocolors@1.1.1 is unmodified.",
    "[behavior-analyst] Candidate contains zero lifecycle scripts, network operations, or child process executions."
  ],
  "reviewStatus": "Awaiting human review",
  "reviewCommand": null,
  "decision": null
}