{
  "schemaVersion": "1.0",
  "runId": "run-1790510569512-zdvxxf",
  "subjectDigest": "098de04af3cff188ca0c8e488678471ee3575a8e94cc76c5c95ee8c7d5de7c28",
  "generatedAt": "2026-09-27T12:03:17.712Z",
  "mode": "live",
  "collectionStatus": "complete",
  "overallRecommendation": "QUARANTINE",
  "keyReasons": [
    "All three Bob investigations must complete before an ALLOW recommendation.",
    "No static observations were recorded in this evidence bundle.",
    "See the source records for collected evidence; an absence of findings is not a guarantee of safety."
  ],
  "packages": [
    {
      "name": "ms",
      "version": "2.1.3",
      "previousVersion": "2.1.2",
      "location": "node_modules/ms",
      "changeType": "changed",
      "isDirect": true,
      "isDev": false,
      "isOptional": false,
      "resolved": "https://registry.npmjs.org/ms/-/ms-2.1.3.tgz",
      "integrity": "sha512-6FlzubTLZG3J2a/NVCAleEhjzq5oxgHyaCU9yYXvcLsvoVaHJq/s5xXI6/XXP6tz7R9xAOtHnSO/tXtF3WRTlA==",
      "previousIntegrity": "sha512-sGkPx+VjMtmA6MX27oA4FBFELFCZZ4S4XqeGOXCv68tT+jb3vk/RyaKWP0PTKyWtmLSM0b+42MKzXi8HBZ50zA==",
      "hasInstallScript": false,
      "scripts": {
        "lint": "eslint lib/* bin/*",
        "test": "mocha tests.js",
        "precommit": "lint-staged"
      },
      "unsupported": false,
      "unsupportedReason": null,
      "provenance": {
        "publishedAt": "2020-12-08T13:54:35.223Z",
        "maintainersCount": 6,
        "repositoryUrl": "git+https://github.com/vercel/ms.git",
        "hasAttestation": false,
        "tarballUrl": "https://registry.npmjs.org/ms/-/ms-2.1.3.tgz",
        "isSynthetic": false
      }
    },
    {
      "name": "picocolors",
      "version": "1.1.1",
      "previousVersion": null,
      "location": "node_modules/picocolors",
      "changeType": "added",
      "isDirect": true,
      "isDev": false,
      "isOptional": false,
      "resolved": "https://registry.npmjs.org/picocolors/-/picocolors-1.1.1.tgz",
      "integrity": "sha512-xceH2snhtb5M9liqDsmEw56le376mTZkEX/jEb/RxNFyegNul7eNslCXP9FDj/Lcu0X8KEyMceP2ntpaHrDEVA==",
      "previousIntegrity": null,
      "hasInstallScript": false,
      "scripts": {},
      "unsupported": false,
      "unsupportedReason": null,
      "provenance": {
        "publishedAt": "2024-10-16T18:20:03.921Z",
        "maintainersCount": 1,
        "repositoryUrl": "git+https://github.com/alexeyraspopov/picocolors.git",
        "hasAttestation": false,
        "tarballUrl": "https://registry.npmjs.org/picocolors/-/picocolors-1.1.1.tgz",
        "isSynthetic": false
      }
    }
  ],
  "investigations": null,
  "investigationComplete": false,
  "observations": [],
  "sources": [
    {
      "sourceType": "live",
      "pathOrUrl": "https://registry.npmjs.org/ms/-/ms-2.1.3.tgz",
      "retrievalTime": "2026-09-27T12:02:49.637Z",
      "contentDigest": "sha512-6FlzubTLZG3J2a/NVCAleEhjzq5oxgHyaCU9yYXvcLsvoVaHJq/s5xXI6/XXP6tz7R9xAOtHnSO/tXtF3WRTlA=="
    },
    {
      "sourceType": "live",
      "pathOrUrl": "https://registry.npmjs.org/ms",
      "retrievalTime": "2026-09-27T12:02:49.638Z",
      "contentDigest": "sha256-metadata:a594a3e5b5e1adc7c4453ea84815f1d2c275de380ac24303000c439f55aabb60"
    },
    {
      "sourceType": "live",
      "pathOrUrl": "https://registry.npmjs.org/picocolors/-/picocolors-1.1.1.tgz",
      "retrievalTime": "2026-09-27T12:02:49.704Z",
      "contentDigest": "sha512-xceH2snhtb5M9liqDsmEw56le376mTZkEX/jEb/RxNFyegNul7eNslCXP9FDj/Lcu0X8KEyMceP2ntpaHrDEVA=="
    },
    {
      "sourceType": "live",
      "pathOrUrl": "https://registry.npmjs.org/picocolors",
      "retrievalTime": "2026-09-27T12:02:49.704Z",
      "contentDigest": "sha256-metadata:6d25362e0a56809b0bd10cabc19426363c8f9f10883c4b0d4242c7d8e0767ad9"
    }
  ],
  "unknowns": [
    "Runtime dynamic effects were not executed or observed.",
    "Full cryptographic npm provenance was not verified (adapter extension pending).",
    "Missing Bob investigation: typosquat-detective",
    "Missing Bob investigation: provenance-auditor",
    "Missing Bob investigation: behavior-analyst"
  ],
  "reviewStatus": "Awaiting complete Bob investigations",
  "reviewCommand": null,
  "decision": null
}